{
  "contract_version": "relay.v1",
  "owner_id": "fixture-household-0001",
  "expires_at": "2030-01-01T06:00:00Z",
  "selection": {
    "version": "providers.v1",
    "selected": {
      "candidate": {
        "source": {
          "id": "synthetic-source-0001",
          "provider": "vidfast",
          "server": "fixture-server",
          "title": {
            "type": "movie",
            "tmdb_id": 27205,
            "imdb_id": "tt1375666"
          },
          "content_verified": false,
          "selected_variant_url": "https://media.example.com/video/1080.m3u8",
          "url": "https://media.example.com/master.m3u8",
          "format": "hls",
          "fetch_context": {
            "public_resources": {
              "referer": "https://provider.example.com/"
            }
          },
          "resolver_metadata": {
            "tracks_known": false,
            "provider_data": {
              "fixture": true,
              "language_evidence": "unknown"
            }
          }
        },
        "observation": {
          "at": "2030-01-01T00:00:00Z",
          "accessible": true,
          "format": "hls",
          "playlist_metadata": {
            "tracks_known": true,
            "tracks": [
              {
                "kind": "audio",
                "language": "en",
                "name": "English",
                "group": "audio-en",
                "url": "https://media.example.com/audio/en.m3u8",
                "default": true
              },
              {
                "kind": "subtitles",
                "language": "en",
                "name": "English",
                "group": "subs-en",
                "url": "https://media.example.com/subtitles/en.m3u8",
                "default": false
              }
            ],
            "variants": [
              {
                "url": "https://media.example.com/video/1080.m3u8",
                "width": 1920,
                "height": 1080,
                "bitrate": 6000000,
                "codecs": [
                  "avc1.640028",
                  "mp4a.40.2"
                ],
                "audio_group": "audio-en",
                "subtitle_group": "subs-en"
              }
            ]
          },
          "variant": {
            "url": "https://media.example.com/video/1080.m3u8",
            "width": 1920,
            "height": 1080,
            "bitrate": 6000000,
            "codecs": [
              "avc1.640028",
              "mp4a.40.2"
            ],
            "audio_group": "audio-en",
            "subtitle_group": "subs-en"
          },
          "first_byte": 100000000,
          "delivery_bps": 24000000,
          "samples_completed": 3,
          "sample_bytes": 393216,
          "encrypted": false,
          "protection_known": true
        }
      },
      "score": 40,
      "reasons": [
        "synthetic fixture, not measured runtime evidence"
      ]
    },
    "backups": [],
    "rejected": {},
    "providers": [
      {
        "provider": "vidfast",
        "duration": 1000000000,
        "candidate_count": 1
      }
    ]
  }
}
